{"$schema":"https://json-schema.org/draft/2020-12/schema","$id":"https://raw.githubusercontent.com/ytee/auto-learning-platform/main/schemas/v1/exercise-module.schema.json","title":"AutoLeaP Exercise Module v1","description":"Module metadata, stage plan, maps, quiz and architecture exercise. Checkpoints are stored separately in exercise batches.","type":"object","additionalProperties":false,"required":["schemaVersion","id","title","shortTitle","eyebrow","subtitle","description","methodTitle","methodSteps","caseStudy","notice","referenceLabel","matrixTitle","matrixHeaders","focusTitle","focusHeaders","focusNote","knowledgeCheckTitle","architectureExercise","days","tracks","matrix","focusMap","quiz","references"],"properties":{"schemaVersion":{"type":"integer","const":1},"id":{"type":"string","pattern":"^[a-z0-9]+(?:-[a-z0-9]+)*$"},"title":{"type":"string","minLength":1},"shortTitle":{"type":"string","minLength":1},"eyebrow":{"type":"string","minLength":1},"subtitle":{"type":"string","minLength":1},"description":{"type":"string","minLength":1},"methodTitle":{"type":"string","minLength":1},"methodSteps":{"type":"array","items":{"type":"string","minLength":1},"minItems":1,"uniqueItems":true},"caseStudy":{"type":"object","additionalProperties":false,"required":["title","description"],"properties":{"title":{"type":"string","minLength":1},"description":{"type":"string","minLength":1}}},"notice":{"type":"string","minLength":1},"referenceLabel":{"type":"string","minLength":1},"matrixTitle":{"type":"string","minLength":1},"matrixHeaders":{"type":"array","items":{"type":"string","minLength":1},"minItems":1,"uniqueItems":true},"focusTitle":{"type":"string","minLength":1},"focusHeaders":{"type":"array","items":{"type":"string","minLength":1},"minItems":1,"uniqueItems":true},"focusNote":{"type":"string","minLength":1},"knowledgeCheckTitle":{"type":"string","minLength":1},"architectureExercise":{"type":"object","additionalProperties":false,"required":["title","prompt","structure","challenges"],"properties":{"title":{"type":"string","minLength":1},"prompt":{"type":"string","minLength":1},"structure":{"type":"array","items":{"type":"string","minLength":1},"minItems":1,"uniqueItems":true},"challenges":{"type":"array","items":{"type":"string","minLength":1},"minItems":1,"uniqueItems":true}}},"days":{"type":"array","items":{"type":"object","additionalProperties":false,"required":["day","title","focus","deliverable","target"],"properties":{"day":{"type":"integer","minimum":1,"maximum":10},"title":{"type":"string","minLength":1},"focus":{"type":"string","minLength":1},"deliverable":{"type":"string","minLength":1},"target":{"type":"string","minLength":1}}},"minItems":1,"maxItems":10},"tracks":{"type":"array","items":{"type":"object","additionalProperties":false,"required":["name","desc","iso"],"properties":{"name":{"type":"string","minLength":1},"desc":{"type":"string","minLength":1},"iso":{"type":"string","minLength":1}}},"minItems":1},"matrix":{"type":"array","items":{"type":"array","items":{"type":"string","minLength":1},"minItems":1},"minItems":1},"focusMap":{"type":"array","items":{"type":"array","items":{"type":"string","minLength":1},"minItems":1},"minItems":1},"quiz":{"type":"array","items":{"type":"object","additionalProperties":false,"required":["q","options","answer","why"],"properties":{"q":{"type":"string","minLength":1},"options":{"type":"array","items":{"type":"string","minLength":1},"minItems":2,"uniqueItems":true},"answer":{"type":"integer","minimum":0},"why":{"type":"string","minLength":1}}},"minItems":1},"references":{"type":"array","items":{"type":"object","additionalProperties":false,"required":["name","note"],"properties":{"name":{"type":"string","minLength":1},"note":{"type":"string","minLength":1}}},"minItems":1}}}
